{
  "ein": "123456789",
  "audit_type": "single-audit",
  "auditee_uei": "TEST0001TEST",
  "auditee_zip": "94109",
  "auditor_ein": "987654321",
  "auditor_zip": "94109",
  "auditee_city": "HAL",
  "auditee_name": "IBM Corporation",
  "auditor_city": "Rivendell",
  "is_usa_based": true,
  "auditee_email": "fictional.fac.tester+test@gsa.gov",
  "auditee_phone": "5558675309",
  "auditee_state": "CA",
  "auditor_email": "fictional.fac.tester+test@gsa.gov",
  "auditor_phone": "5558675309",
  "auditor_state": "CA",
  "auditor_country": "USA",
  "auditor_firm_name": "Fellowship",
  "audit_period_covered": "annual",
  "auditee_contact_name": "Frodo Baggins",
  "auditor_contact_name": "Sauron",
  "auditee_contact_title": "Ringbearer",
  "auditor_contact_title": "Dark Lord",
  "multiple_eins_covered": false,
  "multiple_ueis_covered": false,
  "auditee_address_line_1": "HAL",
  "auditor_address_line_1": "Main Hall",
  "met_spending_threshold": true,
  "secondary_auditors_exist": false,
  "audit_period_other_months": "",
  "auditee_fiscal_period_end": "2023-01-01",
  "ein_not_an_ssn_attestation": true,
  "auditee_fiscal_period_start": "2022-01-01",
  "user_provided_organization_type": "non-profit",
  "auditor_ein_not_an_ssn_attestation": true 
}
